{
  "schema_version": "fabricctl.runtime-verification/v1",
  "observed_at": "2026-08-28T10:05:00Z",
  "status": "partial",
  "synthetic_id": "fabric-verify-01",
  "checks": [
    {"id": "runtime.cluster_identity", "status": "pass"},
    {"id": "runtime.components_ready", "status": "pass"},
    {"id": "runtime.synthetic_ingress", "status": "pass"},
    {"id": "runtime.destination_acknowledgement", "status": "unverified"}
  ],
  "limitations": ["the selected destination did not provide a correlation acknowledgement"]
}
